{
  "name": "Hamid Fathi,",
  "bio": "Android Developer with high experience and a demonstrated history of working in the computer software industry and Iran's and Netherland's biggest tech comp",
  "photoURL": "https://avatars.githubusercontent.com/hamidfathi1998",
  "githubURL": "https://github.com/hamidfathi1998"
}
