{
  "name": "Aravind V. Nair",
  "bio": "Google DSC Lead for ASEB, Full-stack Web Developer, Cloud Computing and Cybersecurity Enthusiast, ex-Google TC member, Kung Fu black belt",
  "photoURL": "https://avatars.githubusercontent.com/AravindVNair99",
  "githubURL": "https://github.com/AravindVNair99"
}