{
  "name": "Shubham Datta",
  "bio": "Coprorate Develpment @goClio (ex-@Shopify) + Host @BackbonePodcast | write about #tech, #investing, #finance, #SaaS | more: www.shubhamdatta.com",
  "photoURL": "https://miro.medium.com/v2/resize:fit:2400/1*CooH29d_7r3I78e9Z1pvlA.jpeg",
  "mediumURL": "https://medium.com/@shubham"
}
