{
  "name": "Madalin Valceleanu",
  "bio": "Mobile Software Developer @Vonage\r\n\r\nEnthusiast and passionate about clean code, modular architecture, design patterns and automation.\r\nğŸ‡·ğŸ‡´ - ğŸ‡ªğŸ‡¸ - ğŸ‡¬ğŸ‡§",
  "photoURL": "https://avatars.githubusercontent.com/VMadalin",
  "githubURL": "https://github.com/VMadalin"
}