{
  "name": "Arthur KAZA",
  "bio": "Senior Machine Learning Engineer | Google Developer Group Kinshasa Co-Organizer | AI Product Strategy Lead Engineer | Business Intelligence | AI Architect",
  "photoURL": "https://avatars.githubusercontent.com/ArthurStarks",
  "githubURL": "https://github.com/ArthurStarks"
}
